{
  "schemaVersion": 1,
  "task": {
    "id": "GAP-0008",
    "title": "Populate capability-graph.json and requirement-traceability.json from the real JRN-* journey registry (wave P1-A)",
    "class": "PRODUCT_BEHAVIOR",
    "priority": "P1",
    "status": "CLOSED"
  },
  "source": {
    "repository": "bthwani2-boop/bthwani-suite-next",
    "workBranch": "reemsam",
    "baseSha": "20f2b8c5070a6f9ee11c14118244ff2683ab6e58",
    "contractHash": "sha256:ca7d5fe34873d1ece9971e1b0d06a4f2127df5b457f32103bbb04124da84f429",
    "frozenAt": "2026-07-26T06:30:00Z"
  },
  "problem": {
    "statement": "governance/remediation/capability-graph.json and requirement-traceability.json were both created empty in wave P0-A (population deferred to P1-A: 'يُملأ P1-A'). inventory-capabilities.mjs, built in P0-B, only stubbed each of the 44 JRN-* journeys as {journeyId, populated: false} without parsing the registry's own real per-journey data.",
    "evidenceState": "PROVEN",
    "evidence": [
      { "path": "governance/remediation/capability-graph.json", "note": "nodes: [] before this task; population field already correctly PROGRESSIVE_P1A." },
      { "path": "governance/remediation/requirement-traceability.json", "note": "links: [] before this task." },
      { "path": "tools/remediation/discovery/inventory-capabilities.mjs", "note": "Formerly emitted only {journeyId, populated: false} per journey; the real JRN-* registry document was never parsed for owner/decision/surfaces." },
      { "path": "governance/27_FULLSTACK_MULTI_SURFACE_JOURNEY_REGISTRY.md", "note": "The real, living source of truth for journey id, title, owner, decision, and per-journey candidate surfaces." }
    ],
    "rootCauseHypothesis": [
      "P0-A/P0-B deliberately deferred population to P1-A per the plan; this task performs that deferred population using only real, registry-derived data (owner/title/decision/candidate-surfaces per journey), explicitly not fabricating deeper chain links (actor/step/state/action/controller/api_operation/domain_command/repository/database_effect/event_outbox/readback_surface/error_behavior) that would require per-journey code inspection beyond this registry document."
    ]
  },
  "product": {
    "journey": "all-journeys-index",
    "actors": ["product"],
    "includedSurfaces": ["app-client", "app-partner", "app-captain", "app-field", "control-panel"],
    "excludedSurfaces": ["dsh-backend", "wlt-backend", "identity", "workforce", "platform-control", "providers", "database", "runtime", "infrastructure", "observability"]
  },
  "behavior": {
    "current": [
      "capability-graph.json has zero nodes and requirement-traceability.json has zero links, despite a real, actively maintained 44-journey registry existing."
    ],
    "required": [
      "inventory-capabilities.mjs mechanically parses the real registry (index table + per-journey sections) instead of stubbing; capability-graph.json contains one product_model_node per (journey, registry-declared candidate surface) pair with domain/journey/decision bound from real registry text; requirement-traceability.json links each requirement this session's real closed/open gaps addressed back to its gap, task, and evidence."
    ],
    "forbidden": [
      "Fabricating chain links (actor/step/state/action/controller/etc.) not actually present in the registry or verified against code.",
      "Force-mapping a surface for a journey whose registry text has no matching backtick-quoted surface token (JRN-043, JRN-044 are honestly omitted and tracked as GAP-0007 instead)."
    ]
  },
  "scope": {
    "allowedPaths": [
      "tools/remediation/discovery/inventory-capabilities.mjs",
      "governance/remediation/capability-graph.json",
      "governance/remediation/requirement-traceability.json",
      "governance/remediation/gap-ledger.json"
    ],
    "forbiddenPaths": [
      "services/**",
      "core/**",
      "apps/**",
      "shared/**",
      "contracts/**",
      ".github/**"
    ],
    "maximumChangedFiles": 4,
    "maximumChangedLines": 800
  },
  "dependencies": {
    "blockedBy": [],
    "blocks": [],
    "sharedContracts": [],
    "sharedGeneratedOutputs": []
  },
  "agents": {
    "required": ["foundation"],
    "maximumRepairIterations": 3,
    "roles": {
      "diagnosedBy": "foundation-diagnosis",
      "executedBy": "foundation-executor",
      "reviewedBy": "independent-implementation-reviewer"
    }
  },
  "workUnits": [],
  "proof": {
    "required": {
      "static": true,
      "contract": false,
      "unit": false,
      "integration": false,
      "database": false,
      "runtime": false,
      "visual": false,
      "native": false,
      "security": false,
      "tenancy": false,
      "performance": false,
      "resilience": false
    },
    "commands": [
      "node tools/remediation/discovery/inventory-capabilities.mjs",
      "node tools/guards/remediation-governance-gate.mjs"
    ],
    "scenarios": [
      { "id": "capability-graph-nodes-derived-from-real-registry-text" },
      { "id": "requirement-traceability-links-only-real-session-gaps" },
      { "id": "no-fabricated-chain-links-or-surfaces" }
    ]
  },
  "acceptance": [
    {
      "id": "AC-001",
      "statement": "capability-graph.json contains a product_model_node for every (journey, registry-declared candidate surface) pair for JRN-001..JRN-042 (122 nodes), each schema-valid and traceable to the registry document.",
      "evidenceRequired": ["static"]
    },
    {
      "id": "AC-002",
      "statement": "requirement-traceability.json links at least one requirement to each of GAP-0001, GAP-0002, GAP-0004, GAP-0005, GAP-0006, and GAP-0007 with real evidence paths.",
      "evidenceRequired": ["static"]
    },
    {
      "id": "AC-003",
      "statement": "JRN-043 and JRN-044, whose registry text has no resolvable candidate-surface token, are honestly omitted from capability-graph.json rather than force-mapped, and the omission is itself tracked as GAP-0007.",
      "evidenceRequired": ["static", "governance"]
    }
  ],
  "cleanup": {
    "temporaryPaths": [],
    "expectedArchivedPaths": [],
    "archivePaths": []
  },
  "approval": {
    "protectedDomains": [],
    "humanApprovalRequired": false
  },
  "budget": {
    "maxJobs": 1,
    "maxRuntimeMinutes": 20,
    "maxAgentIterations": 3,
    "maxChangedFiles": 4,
    "maxChangedLines": 800,
    "maxArtifactsMb": 2,
    "maxFullScans": 0
  },
  "confidence": {
    "productModel": "PROVEN",
    "static": "PROVEN",
    "contract": "NOT_APPLICABLE",
    "database": "NOT_APPLICABLE",
    "runtime": "NOT_APPLICABLE",
    "visual": "NOT_APPLICABLE",
    "native": "NOT_APPLICABLE",
    "security": "NOT_APPLICABLE",
    "tenancy": "NOT_APPLICABLE",
    "finance": "NOT_APPLICABLE",
    "performance": "NOT_APPLICABLE",
    "resilience": "NOT_APPLICABLE",
    "recovery": "NOT_APPLICABLE"
  }
}
